{
  "schema": "boe.mtt.q79-oriented-hodge-real-carrier.v1",
  "claim_id": "CBF.T51",
  "date": "2026-08-31",
  "status": "EXACT_ORIENTED_EXTERIOR_HODGE_AND_CONJUGATE_PAIRED_REAL_CARRIER_COMPILER_PHYSICAL_Q79_METRIC_HYM_OPERATOR_AND_CHIRAL_INDEX_OPEN",
  "source_provenance": {
    "source_lock": "q79_oriented_hodge_real_carrier_source_lock.json",
    "source_hashes_match": {
      "T50_THEOREM": true,
      "T50_PACKET": true,
      "H4_T16_THEOREM": true,
      "H4_T16_CERT": true,
      "H4_T17_THEOREM": true,
      "H4_T17_CERT": true,
      "Q79_FUYAU_BASE": true,
      "PROTOSPINOR_HODGE_TABLE": true,
      "Q79_K3_REAL_STRUCTURE": true,
      "Q79_HODGE_ACTION_AUDIT": true,
      "Q79_FM_HYM_FRONTIER": true
    },
    "all_source_hashes_match": true,
    "model_state_sha256": "5fdba232d862a95c164603f3156f0cfb8f8abed50af0756edc1618457b5d1f45",
    "handoff_id": "e0e3a984-cc12-4140-86d5-432002b346f5"
  },
  "oriented_exterior_hodge": {
    "dimension": 6,
    "basis_dimension": 64,
    "degree_dimensions": {
      "0": 1,
      "1": 6,
      "2": 15,
      "3": 20,
      "4": 15,
      "5": 6,
      "6": 1
    },
    "basis_order": [
      "1",
      "e1",
      "e2",
      "e3",
      "e4",
      "e5",
      "e6",
      "e12",
      "e13",
      "e14",
      "e15",
      "e16",
      "e23",
      "e24",
      "e25",
      "e26",
      "e34",
      "e35",
      "e36",
      "e45",
      "e46",
      "e56",
      "e123",
      "e124",
      "e125",
      "e126",
      "e134",
      "e135",
      "e136",
      "e145",
      "e146",
      "e156",
      "e234",
      "e235",
      "e236",
      "e245",
      "e246",
      "e256",
      "e345",
      "e346",
      "e356",
      "e456",
      "e1234",
      "e1235",
      "e1236",
      "e1245",
      "e1246",
      "e1256",
      "e1345",
      "e1346",
      "e1356",
      "e1456",
      "e2345",
      "e2346",
      "e2356",
      "e2456",
      "e3456",
      "e12345",
      "e12346",
      "e12356",
      "e12456",
      "e13456",
      "e23456",
      "nu"
    ],
    "definition": "star(e_I)=sgn(I,I_complement)e_I_complement in an oriented orthonormal coframe",
    "complete_signed_permutation_table": [
      {
        "column": 0,
        "input": "1",
        "degree": 0,
        "row": 63,
        "output": "nu",
        "sign": 1
      },
      {
        "column": 1,
        "input": "e1",
        "degree": 1,
        "row": 62,
        "output": "e23456",
        "sign": 1
      },
      {
        "column": 2,
        "input": "e2",
        "degree": 1,
        "row": 61,
        "output": "e13456",
        "sign": -1
      },
      {
        "column": 3,
        "input": "e3",
        "degree": 1,
        "row": 60,
        "output": "e12456",
        "sign": 1
      },
      {
        "column": 4,
        "input": "e4",
        "degree": 1,
        "row": 59,
        "output": "e12356",
        "sign": -1
      },
      {
        "column": 5,
        "input": "e5",
        "degree": 1,
        "row": 58,
        "output": "e12346",
        "sign": 1
      },
      {
        "column": 6,
        "input": "e6",
        "degree": 1,
        "row": 57,
        "output": "e12345",
        "sign": -1
      },
      {
        "column": 7,
        "input": "e12",
        "degree": 2,
        "row": 56,
        "output": "e3456",
        "sign": 1
      },
      {
        "column": 8,
        "input": "e13",
        "degree": 2,
        "row": 55,
        "output": "e2456",
        "sign": -1
      },
      {
        "column": 9,
        "input": "e14",
        "degree": 2,
        "row": 54,
        "output": "e2356",
        "sign": 1
      },
      {
        "column": 10,
        "input": "e15",
        "degree": 2,
        "row": 53,
        "output": "e2346",
        "sign": -1
      },
      {
        "column": 11,
        "input": "e16",
        "degree": 2,
        "row": 52,
        "output": "e2345",
        "sign": 1
      },
      {
        "column": 12,
        "input": "e23",
        "degree": 2,
        "row": 51,
        "output": "e1456",
        "sign": 1
      },
      {
        "column": 13,
        "input": "e24",
        "degree": 2,
        "row": 50,
        "output": "e1356",
        "sign": -1
      },
      {
        "column": 14,
        "input": "e25",
        "degree": 2,
        "row": 49,
        "output": "e1346",
        "sign": 1
      },
      {
        "column": 15,
        "input": "e26",
        "degree": 2,
        "row": 48,
        "output": "e1345",
        "sign": -1
      },
      {
        "column": 16,
        "input": "e34",
        "degree": 2,
        "row": 47,
        "output": "e1256",
        "sign": 1
      },
      {
        "column": 17,
        "input": "e35",
        "degree": 2,
        "row": 46,
        "output": "e1246",
        "sign": -1
      },
      {
        "column": 18,
        "input": "e36",
        "degree": 2,
        "row": 45,
        "output": "e1245",
        "sign": 1
      },
      {
        "column": 19,
        "input": "e45",
        "degree": 2,
        "row": 44,
        "output": "e1236",
        "sign": 1
      },
      {
        "column": 20,
        "input": "e46",
        "degree": 2,
        "row": 43,
        "output": "e1235",
        "sign": -1
      },
      {
        "column": 21,
        "input": "e56",
        "degree": 2,
        "row": 42,
        "output": "e1234",
        "sign": 1
      },
      {
        "column": 22,
        "input": "e123",
        "degree": 3,
        "row": 41,
        "output": "e456",
        "sign": 1
      },
      {
        "column": 23,
        "input": "e124",
        "degree": 3,
        "row": 40,
        "output": "e356",
        "sign": -1
      },
      {
        "column": 24,
        "input": "e125",
        "degree": 3,
        "row": 39,
        "output": "e346",
        "sign": 1
      },
      {
        "column": 25,
        "input": "e126",
        "degree": 3,
        "row": 38,
        "output": "e345",
        "sign": -1
      },
      {
        "column": 26,
        "input": "e134",
        "degree": 3,
        "row": 37,
        "output": "e256",
        "sign": 1
      },
      {
        "column": 27,
        "input": "e135",
        "degree": 3,
        "row": 36,
        "output": "e246",
        "sign": -1
      },
      {
        "column": 28,
        "input": "e136",
        "degree": 3,
        "row": 35,
        "output": "e245",
        "sign": 1
      },
      {
        "column": 29,
        "input": "e145",
        "degree": 3,
        "row": 34,
        "output": "e236",
        "sign": 1
      },
      {
        "column": 30,
        "input": "e146",
        "degree": 3,
        "row": 33,
        "output": "e235",
        "sign": -1
      },
      {
        "column": 31,
        "input": "e156",
        "degree": 3,
        "row": 32,
        "output": "e234",
        "sign": 1
      },
      {
        "column": 32,
        "input": "e234",
        "degree": 3,
        "row": 31,
        "output": "e156",
        "sign": -1
      },
      {
        "column": 33,
        "input": "e235",
        "degree": 3,
        "row": 30,
        "output": "e146",
        "sign": 1
      },
      {
        "column": 34,
        "input": "e236",
        "degree": 3,
        "row": 29,
        "output": "e145",
        "sign": -1
      },
      {
        "column": 35,
        "input": "e245",
        "degree": 3,
        "row": 28,
        "output": "e136",
        "sign": -1
      },
      {
        "column": 36,
        "input": "e246",
        "degree": 3,
        "row": 27,
        "output": "e135",
        "sign": 1
      },
      {
        "column": 37,
        "input": "e256",
        "degree": 3,
        "row": 26,
        "output": "e134",
        "sign": -1
      },
      {
        "column": 38,
        "input": "e345",
        "degree": 3,
        "row": 25,
        "output": "e126",
        "sign": 1
      },
      {
        "column": 39,
        "input": "e346",
        "degree": 3,
        "row": 24,
        "output": "e125",
        "sign": -1
      },
      {
        "column": 40,
        "input": "e356",
        "degree": 3,
        "row": 23,
        "output": "e124",
        "sign": 1
      },
      {
        "column": 41,
        "input": "e456",
        "degree": 3,
        "row": 22,
        "output": "e123",
        "sign": -1
      },
      {
        "column": 42,
        "input": "e1234",
        "degree": 4,
        "row": 21,
        "output": "e56",
        "sign": 1
      },
      {
        "column": 43,
        "input": "e1235",
        "degree": 4,
        "row": 20,
        "output": "e46",
        "sign": -1
      },
      {
        "column": 44,
        "input": "e1236",
        "degree": 4,
        "row": 19,
        "output": "e45",
        "sign": 1
      },
      {
        "column": 45,
        "input": "e1245",
        "degree": 4,
        "row": 18,
        "output": "e36",
        "sign": 1
      },
      {
        "column": 46,
        "input": "e1246",
        "degree": 4,
        "row": 17,
        "output": "e35",
        "sign": -1
      },
      {
        "column": 47,
        "input": "e1256",
        "degree": 4,
        "row": 16,
        "output": "e34",
        "sign": 1
      },
      {
        "column": 48,
        "input": "e1345",
        "degree": 4,
        "row": 15,
        "output": "e26",
        "sign": -1
      },
      {
        "column": 49,
        "input": "e1346",
        "degree": 4,
        "row": 14,
        "output": "e25",
        "sign": 1
      },
      {
        "column": 50,
        "input": "e1356",
        "degree": 4,
        "row": 13,
        "output": "e24",
        "sign": -1
      },
      {
        "column": 51,
        "input": "e1456",
        "degree": 4,
        "row": 12,
        "output": "e23",
        "sign": 1
      },
      {
        "column": 52,
        "input": "e2345",
        "degree": 4,
        "row": 11,